exp_id	commit	recall	latency_ms	latency_p95	latency_p99	llm_cost_usd	status	description
exp_000	1a01bb2
exp_001	discarded	0.500000	23.0	27.6	28.6	0.000690	discard	improve recall using RRF instead of weighted summation and better tokenization
exp_002	discarded	0.590909	23.2	26.7	30.6	0.000662	discard	Improve recall by augmenting BM25 tokenization and using hybrid scores with balanced weightings
exp_003	discarded	0.363636	23.7	26.7	28.6	0.000727	discard	replace hybrid scoring with reciprocal rank fusion (RRF) using a larger candidate pool for better recall coverage
exp_004	discarded	0.227273	40.5	50.2	132.5	0.000721	discard	implement balanced RRF with genre-aware query expansion to handle semantic gaps
exp_005	discarded	0.227273	25.7	31.3	68.0	0.000714	discard	implement hybrid retrieval with genre-based boost and improved semantic weighting
exp_006	discarded	0.545455	25.9	30.8	31.7	0.000698	discard	use expanded text field and normalized hybrid scoring to improve recall
exp_007	discarded	0.590909	25.6	28.1	29.5	0.000752	discard	add genre-match scoring and log-transformed popularity boost for retrieval relevance
exp_008	discarded	0.272727	289.0	300.4	324.6	0.000727	discard	implement hybrid retrieval with explicit BM25 title boost and genre-weighted semantic similarity
exp_009	discarded	0.272727	23.8	27.2	28.1	0.000769	discard	hybrid search with re-scoring using BM25, semantic vectors, and genre overlap
exp_010	discarded	0.272727	27.2	30.2	32.0	0.000743	discard	Improve recall by increasing candidate pool size to 2000 for BM25 and adding a genre-aware re-ranking boost.
exp_011	discarded	0.318182	47.4	50.3	145.9	0.000776	discard	hybrid search with improved semantic normalization and weighted genre boosting
exp_012	discarded	0.454545	24.3	34.6	44.0	0.000709	discard	implement balanced RRF with hybrid candidate pooling and title-boosted BM25
exp_013	discarded	0.409091	26.5	29.7	30.8	0.000777	discard	implement balanced RRF with BM25 title weight and genre-boosted re-ranking
exp_014	discarded	0.590909	24.3	27.3	31.9	0.000760	discard	enhance retrieval by incorporating genre overlap and popularity into the ranking score for better precision and recall
exp_015	4453329
exp_016	discarded	0.545455	24.2	27.8	28.1	0.000777	discard	Implement RRF with candidate expansion and title-specific BM25 weighting
exp_017	discarded	0.454545	24.9	30.3	36.2	0.000740	discard	use RRF to combine BM25 and semantic scores for better rank stability
exp_018	discarded	0.090909	94.1	171.9	188.5	0.000766	discard	replace standard hybrid with RRF on expanded candidate set and prioritize title keyword matching
exp_019	discarded	0.454545	25.5	28.7	31.1	0.000778	discard	use genre-aware candidate filtering and RRF to combine signals
exp_020	discarded	0.454545	27.0	32.8	51.2	0.000800	discard	Boost recall by using a multi-field BM25 approach combined with genre-specific re-ranking and semantic search.
exp_021	discarded	0.363636	26.9	37.5	62.7	0.000802	discard	use RRF with cross-field BM25 on title and overview, plus semantic similarity, increasing recall via broader candidate coverage
exp_022	discarded	0.590909	44.3	48.6	68.3	0.000801	discard	implement hybrid retrieval with expanded FAISS index search and multi-feature score weighting
exp_023	discarded	0.590909	32.4	34.7	35.3	0.000810	discard	implement late-stage re-ranking using BM25 and semantic scores with a focus on genre alignment to capture long-tail semantic relationships
exp_024	discarded	0.181818	61.6	65.0	127.2	0.000786	discard	Implement boosted RRF with genre-aware similarity and expanded candidate pool to bridge semantic and keyword gaps
exp_025	discarded	0.409091	33.6	49.8	81.7	0.000812	discard	implement hybrid retrieval with title-bias BM25 and normalized score fusion
exp_026	discarded	0.272727	24.5	28.8	29.6	0.000805	discard	implement hybrid retrieval with expanded candidate pools, BM25 text weighting, and rank-normalization via MinMaxScaling
exp_027	discarded	0.454545	40.6	43.6	44.8	0.000840	discard	implement hybrid retrieval with expanded candidate pools, BM25-based genre boosting, and rank-based fusion
exp_028	discarded	0.545455	26.3	30.2	56.8	0.000823	discard	use query-specific hybrid weight adjustments and expanded candidate pool to boost recall
exp_029	discarded	0.409091	55.2	57.4	58.5	0.000827	discard	Implement BM25 title-boosted hybrid search with rank-based fusion and popularity adjustment
exp_030	discarded	0.409091	25.3	30.7	49.5	0.000810	discard	Implement BM25 with expanded candidate pool and log-scaled popularity-genre fusion
exp_031	discarded	0.454545	31.9	36.3	96.0	0.000787	discard	enhance candidate selection using weighted multi-field BM25 (title/overview) and reciprocal rank fusion to improve recall
exp_032	discarded	0.272727	28.0	36.2	50.2	0.000842	discard	implement genre-aware query expansion and BM25-semantic hybrid fusion with soft genre-boosting
exp_033	discarded	0.409091	37.9	41.7	43.1	0.000826	discard	implement multi-scale BM25 fusion with genre-weighted semantic similarity and boost
exp_034	discarded	0.045455	29.5	39.2	40.1	0.000772	discard	use query-specific genre filtering and aggressive RRF to prioritize exact title matches
exp_035	discarded	0.500000	24.2	29.7	67.3	0.000801	discard	Use expanded BM25/FAISS candidate pools with RRF and genre-boosted ranking
exp_036	discarded	0.454545	26.0	39.6	50.7	0.000820	discard	hybrid search with RRF and dynamic term-frequency weighting using BM25 and semantic embeddings
exp_037	discarded	0.363636	23.8	27.9	28.4	0.000804	discard	Implement BM25 and vector retrieval with an expanded candidate pool and a weighted popularity-genre reranking boost.
exp_038	discarded	0.318182	35.1	39.4	42.0	0.000790	discard	implement balanced RRF with genre-based boost and query-vector expansion
exp_039	discarded	0.363636	26.9	30.0	31.8	0.000845	discard	Implement a two-stage hybrid search with expanded BM25/FAISS candidate pool and genre-similarity re-ranking to boost long-tail recall
exp_040	discarded	0.227273	24.5	28.3	28.7	0.000862	discard	implement reranking with explicit genre overlap and vote-adjusted score balancing
exp_041	discarded	0.363636	54.8	60.1	129.2	0.000803	discard	Implement RRF with expanded candidate pool and query-genre semantic expansion
exp_042	discarded	0.454545	24.8	28.6	31.3	0.000801	discard	Implement RRF with augmented text field and vote-density adjusted scoring
exp_043	discarded	0.000000	51.2	59.6	83.3	0.000819	discard	Implement RRF with candidate expansion, semantic reranking, and genre-based popularity bias
exp_044	discarded	0.636364	26.4	28.6	30.6	0.000850	discard	implement cascaded retrieval with genre-overlap boosting and logarithmic popularity weighting
exp_045	crash	0.000000	inf			0.000861	crash	implement late-stage re-ranking using BM25, semantic scores, and genre-match signals via an expanded candidate pool
exp_046	discarded	0.409091	36.9	39.5	40.3	0.000870	discard	Implement genre-profile embedding injection and rank-based fusion with query-intent balancing
exp_047	discarded	0.363636	26.5	42.1	56.2	0.000863	discard	implement cascaded retrieval with BM25-based re-ranking and score-based filtering
exp_048	discarded	0.409091	28.0	43.6	55.2	0.000884	discard	use query-aware BM25 weighting and rank-based fusion with popularity-genre bias
exp_049	discarded	0.318182	26.1	29.6	31.0	0.000872	discard	Use a balanced hybrid approach with logarithmic genre-popularity weighting and expanded candidate pool retrieval
exp_050	discarded	0.227273	48.2	50.4	51.2	0.000877	discard	improve recall using a larger initial candidate pool and refined hybrid scoring with genre-text feature interaction
exp_052	discarded	0.363636	45.1	48.6	49.6	0.000883	discard	Use a two-stage approach with BM25/FAISS retrieval followed by reranking using a combination of semantic similarity, title keyword density, and genre-alignment scores.
exp_053	discarded	0.590909	30.3	43.5	69.1	0.000864	discard	implement genre-aware query expansion and weighted ensemble re-ranking
exp_054	crash	0.000000	inf			0.000859	crash	Optimize retrieval by implementing a genre-boosted RRF with title-weighting and candidate expansion
exp_055	discarded	0.409091	24.8	29.2	30.5	0.000842	discard	Use Log-Scaled Reciprocal Rank Fusion on separate BM25 and Semantic candidate streams with genre-based popularity prioritization
exp_056	discarded	0.454545	26.3	299.1	308.1	0.000898	discard	Use BM25 cross-field search on title/overview, implement RRF with genre-based rank-booster to improve long-tail recall.
exp_057	discarded	0.318182	27.0	29.9	31.1	0.000886	discard	Implement BM25 title/overview multi-field fusion with semantic reranking and rank-based genre-popularity boosting.
exp_058	discarded	0.363636	32.9	36.8	79.5	0.000909	discard	Implement lexical-semantic fusion using BM25 query-expansion and a genre-aware re-ranking strategy that prioritizes exact title-token matches.
exp_059	discarded	0.363636	26.8	31.0	38.9	0.000942	discard	Use a hybrid retrieval with query-aware term frequency boosting and genre-match re-ranking for improved recall.
exp_060	discarded	0.318182	36.4	40.5	41.5	0.000879	discard	Implement lexical-semantic fusion with explicit genre-match boosting and non-linear RRF rank aggregation.
exp_061	discarded	0.363636	287.7	316.4	344.0	0.000888	discard	Implement lexical-semantic fusion with genre-weighted RRF and dynamic term frequency expansion
exp_062	discarded	0.363636	25.9	32.9	79.5	0.000878	discard	Use RRF with genre-aware rank boosting on a larger candidate pool to bridge lexical and semantic gaps.
exp_063	discarded	0.500000	49.4	52.1	52.9	0.000929	discard	Implement lexical-semantic fusion with BM25/FAISS boosting and genre-aware re-ranking
exp_064	discarded	0.272727	55.2	58.2	58.9	0.000897	discard	Implement lexical-semantic fusion with reciprocal rank fusion (RRF) and genre-based popularity enhancement.
exp_065	discarded	0.500000	28.7	32.0	32.9	0.000917	discard	hybrid search with genre-boosted reranking and expanded FAISS/BM25 recall
exp_066	discarded	0.227273	130.9	136.3	136.8	0.000921	discard	implement genre-aware query expansion and title-weighted reranking for better recall
exp_067	discarded	0.181818	30.8	33.0	33.7	0.000910	discard	hybrid search with genre-boosted title keyword density and reranked RRF
exp_068	discarded	0.227273	26.7	30.1	39.6	0.000883	discard	Implement lexical-semantic fusion with BM25 title/overview-field weighting and genre-aware re-ranking
exp_069	discarded	0.272727	23.6	28.4	35.6	0.000851	discard	Utilize RRF for hybrid ranking with genre and popularity-weighted signals on an expanded candidate pool.
exp_070	discarded	0.272727	26.4	30.2	32.0	0.000886	discard	Implement lexical-semantic fusion using BM25 and vector similarity with genre-conditioned re-ranking to boost retrieval for ambiguous queries.
exp_071	discarded	0.318182	23.6	27.3	28.6	0.000919	discard	Use exact-field BM25 on titles, weighted fusion with semantic similarity, and genre-based candidate boosting for higher recall
exp_072	discarded	0.318182	24.8	29.5	32.1	0.000917	discard	combine lexical and semantic streams with field-weighted BM25 and genre-similarity boost
exp_073	discarded	0.409091	24.3	28.0	29.5	0.000910	discard	utilize BM25 on full text (title + overview + genres) and semantic reranking with popularity-aware score fusion
exp_074	discarded	0.272727	25.1	28.9	30.3	0.000967	discard	implement genre-aware field-boosted BM25 with semantic reranking and logarithmic popularity dampening
exp_075	discarded	0.454545	93.5	98.1	100.0	0.000908	discard	Implement lexical-semantic RRF with genre-based candidate boosting and title-token popularity weighting
exp_076	discarded	0.136364	70.1	75.4	76.3	0.000924	discard	hybrid search with term-frequency-aware title boosting and genre-similarity re-ranking
exp_077	discarded	0.181818	53.9	56.5	56.9	0.000893	discard	Use balanced RRF on BM25 and semantic pools with title-specific keyword boosting to improve ranking precision.
exp_078	discarded	0.318182	25.2	28.2	30.6	0.000943	discard	Implement lexical-semantic fusion with BM25 title/overview-field weighting, genre-aware re-ranking, and dynamic candidate expansion.
exp_079	discarded	0.272727	24.6	27.9	29.6	0.000921	discard	Implement lexical-semantic fusion with genre-affinity scoring and weight-tuned RRF.
exp_080	discarded	0.545455	25.6	29.2	29.8	0.000939	discard	use query-aware genre vector bias and expanded candidate pool to bridge lexical-semantic gaps
exp_081	discarded	0.227273	22.9	27.1	29.5	0.000970	discard	Implement lexical-semantic fusion with genre-query intersection and non-linear popularity-dampened scoring to improve precision for long-tail queries.
exp_082	discarded	0.590909	41.0	43.6	69.7	0.000935	discard	enhance candidate selection using query-term genre boosting and popularity-aware reranking
exp_083	discarded	0.318182	32.9	52.2	52.9	0.000959	discard	Use RRF on expanded candidates with query-genre alignment and title-boosted BM25
exp_084	discarded	0.227273	23.1	27.6	44.3	0.000954	discard	combine lexical and semantic streams with field-weighted BM25 on titles and popularity-prioritized reranking
exp_085	discarded	0.363636	70.6	74.6	76.4	0.000905	discard	Use genre-vector fusion with adaptive BM25 and high-precision RRF for improved recall
exp_086	discarded	0.500000	25.7	166.8	168.7	0.000942	discard	use query-aware genre-title BM25 field weighting with aggressive candidate expansion and RRF-weighted scoring
exp_087	discarded	0.409091	40.6	42.7	44.9	0.000948	discard	augment candidate pool with BM25/FAISS overlap and apply genre-weighted score fusion
exp_088	discarded	0.545455	24.6	29.2	30.4	0.000966	discard	Implement lexical-semantic RRF with genre-intersection boosting and query-intent genre weighting
exp_089	discarded	0.227273	54.2	56.4	56.9	0.000887	discard	Implement RRF with genre-aware similarity and expanded candidate pool to bridge semantic and keyword gaps
exp_090	discarded	0.545455	24.6	27.8	30.1	0.000948	discard	leverage multi-field BM25 on text/genres and use RRF for robust rank fusion with vote-count bias
exp_091	discarded	0.272727	26.4	56.1	57.7	0.000951	discard	Utilize RRF with genre-aware similarity and query-dependent semantic amplification to boost retrieval recall.
exp_092	discarded	0.500000	23.8	27.1	29.5	0.000939	discard	implement balanced RRF with genre-intersection boosting and vote-adjusted rank scoring
exp_093	discarded	0.363636	26.7	30.0	31.1	0.000977	discard	integrate title-weighted BM25 with genre-affinity reranking and normalized score fusion
exp_094	discarded	0.500000	56.0	64.0	80.7	0.000961	discard	implement genre-aware RRF with popularity-weighted boosting
exp_095	discarded	0.227273	54.0	57.1	78.0	0.000950	discard	implement hybrid retrieval with explicit title keyword boosting and genre-similarity reranking using RRF for signal aggregation
exp_096	discarded	0.590909	26.6	33.2	46.6	0.001007	discard	hybrid search with term-boosted BM25 and genre-similarity re-ranking
exp_097	discarded	0.545455	27.3	32.0	54.5	0.000963	discard	implement lexical-semantic RRF with title-boosted BM25 and genre-conditional reranking
exp_098	discarded	0.318182	25.3	50.0	50.4	0.000995	discard	Combine RRF with query-intent genre vector boosting and log-popularity normalization
exp_099	discarded	0.454545	42.2	44.8	47.1	0.000935	discard	implement hybrid retrieval with genre-conditional reranking and BM25 tokenization enhancement
exp_100	crash	0.000000	inf			0.000955	crash	hybrid search with term-frequency-aware title/genre boosting and RRF
exp_101	discarded	0.409091	28.5	57.5	58.8	0.001025	discard	Implement genre-aware reranking with BM25/Semantic fusion using a weighted popularity boost for long-tail relevance.
exp_102	62db656	0.681818	24.5	29.9	32.8	0.000963	keep	use query-aware genre-vector expansion with BM25-semantic fusion and vote-density rank adjustment
exp_103	discarded	0.545455	25.7	29.7	30.4	0.000958	discard	hybrid search with term-frequency-aware title-field BM25 and genre-conditional reranking via RRF
exp_104	discarded	0.000000	41.9	44.7	46.3	0.000960	discard	implement genre-aware field-boosted BM25 and normalized reciprocal rank fusion with candidate pruning
exp_105	discarded	0.318182	25.5	28.8	30.9	0.000970	discard	use query-specific genre-vector similarity fusion with popularity-weighted ranking
exp_106	discarded	0.636364	25.2	28.2	30.8	0.000960	discard	add query-dependent genre boosting and vote-score dampening to improve precision
exp_107	discarded	0.454545	24.8	27.8	29.0	0.000983	discard	Improve recall by expanding candidate pools and using a genre-aware weighted score fusion that prioritizes lexical precision.
exp_108	discarded	0.409091	25.2	29.4	63.9	0.001007	discard	use query-specific genre-vector similarity fusion with popularity-weighted ranking and title-boosted BM25
exp_109	discarded	0.636364	25.5	29.5	30.5	0.000986	discard	use RRF with field-weighted BM25 on title/text and semantic similarity with popularity-prioritized boosting
exp_110	discarded	0.454545	24.9	29.4	30.2	0.000952	discard	implement balanced RRF with genre-intersection boosting and vote-adjusted rank scoring
exp_111	discarded	0.409091	38.8	43.4	74.2	0.001018	discard	Implement lexical-semantic RRF with title-boosted BM25 and genre-conditional reranking using popularity-dampened scores
exp_112	discarded	0.318182	25.4	28.4	30.7	0.000990	discard	improve candidate selection using query-term genre weighting and title-boosted bm25 scoring
exp_113	discarded	0.409091	23.7	26.9	29.2	0.000943	discard	use RRF to combine BM25 and semantic signals, using a simple popularity-boosted rank fusion to improve candidate selection.
exp_114	discarded	0.136364	24.4	27.7	29.0	0.000977	discard	simple hybrid retrieval with title-bias BM25 and normalized reciprocal rank fusion
exp_115	discarded	0.454545	41.2	47.4	86.2	0.000972	discard	implement balanced RRF with genre-intersection boosting and vote-adjusted rank scoring
exp_116	discarded	0.409091	25.0	31.0	51.2	0.001004	discard	implement hybrid retrieval with title-text field weighting and genre-aware reciprocal rank fusion
exp_117	crash	0.000000	inf			0.001013	crash	Use RRF for hybrid fusion with title-text field-weighted BM25 and genre-aware popularity-weighted boosting
exp_118	crash	0.000000	inf			0.001071	crash	Implement lexical-semantic fusion using RRF on title/text fields with genre-vector alignment and vote-count bias.
exp_119	discarded	0.318182	36.3	38.4	39.3	0.001018	discard	Use balanced RRF with genre-intersection boosting and vote-adjusted rank scoring
exp_120	discarded	0.363636	24.8	28.4	29.0	0.001013	discard	implement balanced RRF with genre-intersection boosting and vote-adjusted score rank fusion
exp_121	discarded	0.545455	32.5	37.1	38.7	0.001021	discard	Implement lexical-semantic RRF with title-boosted BM25 and genre-conditional reranking
exp_122	discarded	0.590909	24.3	27.5	28.4	0.001013	discard	Use balanced RRF with title-boosted BM25 and genre-similarity boost for candidate ranking
exp_123	discarded	0.363636	24.4	30.3	31.7	0.001082	discard	Implement lexical-semantic fusion with RRF on title-weighted BM25 and genre-boosted semantic similarity
exp_124	discarded	0.590909	23.9	27.2	29.1	0.001014	discard	hybrid search with RRF, genre-overlap boosting, and popularity dampening
exp_125	discarded	0.318182	23.4	28.6	35.9	0.001053	discard	improve hybrid retrieval by combining BM25 and semantic scores using a normalized rank fusion with genre-specific boost
exp_126	discarded	0.318182	24.1	27.7	30.3	0.001021	discard	use RRF on a larger candidate pool with normalized BM25 and semantic score fusion
exp_127	discarded	0.590909	24.5	31.2	37.0	0.001035	discard	Implement lexical-semantic fusion using RRF with title-text field weighting and genre-popularity boosting
exp_128	discarded	0.409091	23.1	27.3	28.5	0.001032	discard	Implement lexical-semantic fusion with boosted RRF and genre-overlap scoring
exp_129	discarded	0.318182	29.9	34.1	34.6	0.001004	discard	Implement RRF with multi-field BM25 boosting and genre-affinity scoring
exp_130	discarded	0.227273	23.8	30.0	31.9	0.001019	discard	implement genre-aware RRF with title-boosted BM25
exp_131	discarded	0.272727	31.6	36.7	37.4	0.001016	discard	Use a combined title/text BM25 index with RRF rank-aggregation and genre-weighted vote bias
exp_132	discarded	0.318182	23.5	27.3	28.4	0.001032	discard	use RRF with cross-field BM25 on title/text and semantic similarity to optimize rank stability
exp_133	crash	0.000000	inf			0.001047	crash	Implement lexical-semantic fusion with boosted RRF, combining BM25 title/overview-field scoring with semantic similarity, and incorporating popularity-weighted genre affinity to refine ranking.
exp_134	discarded	0.409091	23.9	27.3	29.1	0.001045	discard	Implement lexical-semantic fusion with RRF, query-term-weighted genre matching, and explicit popularity dampening.
exp_135	discarded	0.409091	23.3	27.1	27.8	0.001025	discard	use RRF on a filtered candidate pool with genre-aware semantic and BM25 scoring
exp_136	discarded	0.545455	23.5	26.5	28.2	0.001009	discard	balanced RRF with genre affinity and log-popularity weighting
exp_137	discarded	0.409091	23.7	26.4	28.0	0.001016	discard	hybrid search with RRF and rank-based popularity/genre amplification
exp_138	discarded	0.272727	44.2	49.8	50.5	0.001037	discard	implement balanced RRF with genre-intersection boosting and title-token density weighting
exp_139	discarded	0.318182	24.2	27.4	28.2	0.001052	discard	RRF-based hybrid search with semantic-genre cross-attention and popularity-weighted ranking
exp_140	discarded	0.318182	24.8	28.9	29.1	0.001063	discard	balanced hybrid search using RRF on title-boosted BM25 and semantic embeddings with genre-affinity reranking
exp_141	discarded	0.272727	32.8	35.9	36.1	0.001040	discard	hybrid retrieval with title-token BM25 boosting and reciprocal rank fusion
exp_142	discarded	0.409091	24.0	27.5	28.9	0.001061	discard	implement balanced RRF with genre-intersection boosting and vote-adjusted score rank fusion
