exp_id	commit	recall	latency_ms	latency_p95	latency_p99	llm_cost_usd	status	description
exp_143	discarded	0.227273	25.8	29.9	30.6	0.001044	discard	Use RRF on an expanded 500-candidate pool with direct genre-keyword intersection boosting to improve rank precision and recall.
exp_144	discarded	0.409091	34.3	37.7	38.6	0.001038	discard	Hybrid search using BM25 and semantic vectors with genre-aware RRF ranking and popularity-boosted signal normalization
exp_145	discarded	0.227273	26.4	30.2	30.6	0.001083	discard	use RRF on a larger 400-candidate pool with boosted title-match weights and genre-affinity scoring
exp_146	discarded	0.590909	23.1	27.0	40.9	0.001064	discard	improved hybrid search with reciprocal rank fusion on top-k candidates and genre-aware popularity-weighted scoring
exp_147	discarded	0.227273	23.9	28.0	28.9	0.001072	discard	implement hybrid retrieval with title-bias BM25 and genre-aware reranking using score normalization
exp_148	discarded	0.363636	1900.4	2580.0	2944.9	0.001012	discard	Use semantic retrieval as the primary signal with a genre-boosted BM25 re-ranker for top-tier candidates
exp_149	discarded	0.454545	23.4	27.4	28.2	0.001026	discard	use weighted reciprocal rank fusion with explicit genre-match boosting and normalized vote-based popularity bias
exp_150	discarded	0.454545	23.6	27.3	29.2	0.001076	discard	replace hybrid weighting with a multi-stage reranking pipeline using log-normalized genre-vote scoring and RRF
exp_151	discarded	0.136364	24.8	28.3	29.5	0.001069	discard	Implement RRF with title-text field weighting and genre-conditioned similarity scoring to address rank-order failures
exp_152	discarded	0.409091	31.1	34.3	86.9	0.001086	discard	Reduce candidate pool to 200 for faster latency while using a weighted BM25/Semantic fusion with genre-affinity bias to maintain recall.
exp_153	discarded	0.272727	25.1	28.1	54.9	0.001090	discard	implement latency-optimized hybrid retrieval using pre-computed candidate pools and efficient rank-weighted aggregation
exp_154	discarded	0.272727	24.7	36.6	47.7	0.001064	discard	optimize latency by reducing candidate pool and removing redundant dataframe operations
exp_155	discarded	0.363636	23.7	28.9	51.9	0.001046	discard	Optimize latency by using a smaller candidate pool and simplified direct ranking.
exp_156	discarded	0.272727	24.7	35.9	46.4	0.001018	discard	latency optimization through pool reduction and direct index scoring without unnecessary dataframe copies
exp_157	crash	0.000000	inf			0.001052	crash	optimize latency by using local indexing and minimizing data manipulation
exp_158	discarded	0.318182	23.3	26.5	29.4	0.001061	discard	optimize latency by reducing candidate pool, caching tokenization, and using minimal feature weighting
exp_159	crash	0.000000	inf			0.001061	crash	optimize latency by using a streamlined candidate fusion approach with direct index querying and reduced dataframe overhead
exp_160	discarded	0.272727	23.6	26.1	26.5	0.001093	discard	optimize latency by using a streamlined, pre-filtered candidate pool and direct indexing without redundant dataframe object creation
exp_161	discarded	0.454545	23.5	31.4	32.8	0.001119	discard	optimize latency by using a combined text-field index and vector-distance ranking with simplified, efficient scoring
exp_162	discarded	0.363636	23.5	26.6	30.5	0.001103	discard	Use a single-pass hybrid ranking with pre-indexed BM25 scores and normalized vector distances to reduce dataframe overhead and latency.
exp_163	discarded	0.227273	23.2	30.9	48.8	0.001088	discard	replace hybrid scoring with query-dependent RRF for latency and precision
exp_164	discarded	0.272727	23.1	25.9	27.3	0.001122	discard	optimize latency by using local NumPy arrays and reducing data conversion overhead during hybrid score calculation
exp_165	discarded	0.227273	36.1	40.8	41.4	0.001074	discard	optimize latency by using fixed-size vector similarity and simplified score fusion
exp_166	discarded	0.227273	23.1	26.6	43.8	0.001071	discard	latency optimization using direct index search and vectorized scoring with minimal dataframe operations
exp_167	discarded	0.363636	22.7	25.8	34.5	0.001108	discard	optimize latency by using local indexing, vectorized score fusion, and efficient candidate pool management
exp_168	discarded	0.181818	23.5	26.5	34.6	0.001086	discard	latency optimization using pre-filtered candidate pool and efficient ranking with minimal data conversion
exp_169	discarded	0.272727	23.8	30.7	38.3	0.001124	discard	Latency-optimized retrieval using cached BM25 scores and direct vectorized indexing with minimal DataFrame overhead.
exp_170	discarded	0.272727	24.1	26.4	27.6	0.001078	discard	use query-specific genre boost and efficient top-k candidate scoring to reduce latency while maintaining recall
exp_171	discarded	0.227273	23.4	27.5	76.4	0.001077	discard	optimize latency by using direct index search, removing redundant candidate set unions, and streamlining BM25 tokenization for faster feature extraction
exp_172	discarded	0.227273	24.2	26.8	27.1	0.001134	discard	Optimized hybrid search with pre-calculated BM25 and vector scores, using a direct indexing approach to minimize DataFrame overhead while maintaining recall through score-weighted candidate fusion.
exp_173	discarded	0.227273	23.8	26.5	28.9	0.001177	discard	optimize latency by using local NumPy arrays, simplified ranking, and reduced dataframe overhead for candidate processing
exp_174	discarded	0.363636	23.4	27.0	27.9	0.001111	discard	optimize latency by using a single-pass hybrid score with pre-sorted BM25 indices and efficient vector-index lookup.
exp_175	discarded	0.227273	23.1	26.9	29.1	0.001130	discard	optimize latency by using a smaller candidate pool with a direct score-weighted fusion on pre-calculated indices.
exp_176	discarded	0.409091	39.0	42.4	64.0	0.001120	discard	implement balanced RRF with popularity-weighted genre boost to improve rank stability and recall
exp_177	discarded	0.318182	23.4	26.1	27.7	0.001133	discard	latency optimization through minimal feature calculation and balanced hybrid retrieval
exp_178	discarded	0.136364	22.8	26.0	29.4	0.001097	discard	latency optimized hybrid retrieval with minimal overhead and prioritized BM25 scoring
exp_179	discarded	0.272727	23.1	26.7	27.7	0.001049	discard	optimize latency by using local NumPy arrays, efficient candidate set union, and minimal feature calculation
exp_180	discarded	0.227273	23.2	26.0	26.6	0.001098	discard	Latency-optimized hybrid retrieval using targeted vector-BM25 fusion with early-exit scoring on reduced candidate pools
exp_181	discarded	0.454545	24.3	27.9	63.6	0.001184	discard	Optimized latency by replacing multi-step fusion with a single-pass RRF-like score on a consolidated 300-candidate pool, leveraging local numpy indexing to minimize dataframe overhead.
exp_182	discarded	0.181818	24.1	27.1	27.9	0.001122	discard	Latency optimization using combined vector and BM25 index scoring with early-exit scoring on smaller pool size
exp_183	discarded	0.318182	23.3	26.1	28.4	0.001108	discard	Latency-optimized retrieval using shared-index candidate pooling and direct score-fused numpy ranking.
exp_184	discarded	0.318182	23.6	26.5	28.0	0.001180	discard	Latency-optimized hybrid retrieval using a focused candidate pool, pre-computed BM25 scores, and a lightweight, vectorized ranking pipeline.
exp_185	crash	0.000000	inf			0.001127	crash	optimized latency by streamlining hybrid scoring and utilizing vectorized NumPy operations on a unified candidate pool
exp_186	discarded	0.318182	23.5	26.8	27.1	0.001122	discard	Use a single-pass hybrid ranking with pre-indexed BM25 scores and normalized vector distances to reduce dataframe overhead and latency.
exp_187	0dc7372	0.636364	23.4	30.0	37.1	0.001152	keep	latency optimization using pre-filtered candidate pool and direct indexing with minimal dataframe operations
exp_188	discarded	0.318182	23.4	26.1	27.2	0.001131	discard	Optimize latency by using a combined retrieval pool size of 200, simplifying scoring via vectorized addition of BM25 and normalized distance, and reducing DataFrame operations by using column indexing.
exp_189	discarded	0.318182	23.3	27.1	27.8	0.001151	discard	improve latency by using optimized array indexing and batching, while maintaining recall with genre-boosted scores
exp_190	discarded	0.272727	23.8	27.9	73.0	0.001148	discard	reduce latency by pre-allocating index lookups and simplifying hybrid score fusion logic
exp_191	discarded	0.590909	23.6	26.9	27.5	0.001147	discard	optimize latency by using a streamlined candidate union and reduced feature overhead
exp_192	discarded	0.636364	23.7	26.6	27.5	0.001158	discard	Optimize latency by using a smaller initial candidate pool, simplified feature-vector scoring, and reducing redundant dataframe operations.
exp_193	crash	0.000000	inf			0.001130	crash	optimize latency by using local indexing and vectorized hybrid scoring
exp_194	discarded	0.500000	23.0	26.3	28.9	0.001181	discard	optimize latency by using a streamlined candidate pool of 250, direct array indexing, and simplified feature-weighted fusion
exp_195	discarded	0.590909	23.0	26.6	27.4	0.001190	discard	Optimize latency by using a streamlined candidate pool of 200, simplifying scoring via vectorized addition of BM25 and normalized distance, and reducing DataFrame operations by using direct array indexing.
exp_196	discarded	0.681818	23.1	28.6	37.5	0.001172	discard	Optimize latency by using a streamlined candidate pool of 200, simplifying BM25 and vector score fusion, and using vectorized numpy operations to minimize overhead.
exp_197	discarded	0.318182	23.7	26.1	26.7	0.001180	discard	latency-optimized retrieval using cached BM25 and vectorized genre-boosted ranking on a unified candidate pool
exp_198	discarded	0.272727	23.9	28.5	35.0	0.001171	discard	optimize latency by using local numpy pre-indexing for BM25 and pre-computed genre masks to avoid redundant dataframe operations during ranking
exp_199	discarded	0.409091	23.6	27.2	28.8	0.001189	discard	optimize latency by using local NumPy arrays, cached BM25 scores, and a lightweight weighted ranking pipeline without intermediate dataframe filtering
exp_200	discarded	0.454545	23.3	28.3	34.2	0.001194	discard	optimize latency by using a streamlined candidate selection and direct array-based scoring to eliminate redundant dataframe processing
exp_201	discarded	0.409091	23.4	26.3	27.8	0.001236	discard	optimize latency by using a combined 250 candidate pool with direct numpy array indexing and simplified scoring without pandas iloc or copy operations
exp_202	discarded	0.318182	23.0	26.2	26.7	0.001176	discard	Refactor scoring to use direct numpy indexing and vectorized operations, avoiding pandas overhead and optimizing memory usage for cost efficiency.
exp_203	discarded	0.545455	29.9	32.6	33.9	0.001227	discard	Use balanced RRF with popularity-weighted genre boost to improve retrieval recall and ranking stability.
exp_204	discarded	0.227273	23.6	26.6	27.4	0.001194	discard	Use a larger candidate pool of 400 for hybrid retrieval with genre-overlap boosting and direct NumPy score normalization.
exp_205	discarded	0.318182	22.9	27.7	32.6	0.001188	discard	implement genre-aware query expansion for hybrid search and streamline the candidate pool scoring pipeline
exp_206	discarded	0.636364	28.5	35.5	106.5	0.001220	discard	implement genre-aware query expansion and weight fusion with popularity dampening
exp_207	e2e2ad5	0.590909	23.1	27.0	28.2	0.001210	keep	use query-aware genre-boosted hybrid search with pre-computed popularity normalization to reduce dataframe overhead
exp_208	discarded	0.318182	24.5	29.9	44.6	0.001207	discard	Optimize retrieval cost by using a unified candidate pool and simplifying rank fusion logic to reduce dataframe operations.
exp_209	e0a0775	0.636364	23.2	26.4	27.8	0.001173	keep	utilize BM25 on the full 'text' field to improve coverage and simplify candidate pool retrieval to reduce latency and cost while maintaining recall stability.
exp_210	discarded	0.363636	23.4	26.4	28.6	0.001160	discard	enhance cost efficiency by simplifying the candidate scoring pipeline using vectorized score normalization and pre-computed popularity weights
exp_211	discarded	0.500000	23.0	26.4	27.1	0.001182	discard	implement lexical-semantic fusion with genre-query interaction and popularity-dampened score fusion
exp_212	discarded	0.272727	22.9	26.0	27.0	0.001176	discard	Optimize retrieval cost by using a unified candidate pool and genre-affinity re-scoring without redundant dataframe operations.
exp_213	discarded	0.409091	24.1	28.0	34.8	0.001132	discard	Optimize retrieval cost by using simplified score fusion with vectorized candidate retrieval and direct NumPy operations.
exp_214	discarded	0.181818	29.5	32.7	34.3	0.001226	discard	hybrid search with genre-aware BM25 boosting and non-linear score fusion for better rank precision
exp_215	discarded	0.363636	23.5	27.0	50.8	0.001164	discard	Optimize retrieval cost by using a unified candidate pool of 300 with simplified scoring and direct NumPy indexing to reduce redundant DataFrame overhead.
exp_216	discarded	0.363636	23.5	26.4	27.9	0.001226	discard	refine hybrid scoring with logarithmic genre-popularity weight adjustment to improve precision without increasing latency
exp_217	discarded	0.409091	23.8	27.9	45.4	0.001192	discard	Use a balanced RRF with popularity weighting and simplified candidate scoring to improve retrieval recall while maintaining latency and cost efficiency.
exp_218	discarded	0.363636	24.0	26.7	30.0	0.001239	discard	Optimized retrieval by incorporating a genre-affinity multiplier into the BM25-semantic fusion pipeline using direct index access to reduce overhead.
exp_219	discarded	0.454545	27.5	30.7	31.0	0.001199	discard	implement genre-aware RRF with title-boosted BM25 and popularity-dampened scoring
exp_220	discarded	0.272727	22.3	26.1	29.8	0.001185	discard	Implement genre-aware reranking using direct numpy array indexing to eliminate redundant dataframe operations and improve cost/latency.
exp_221	discarded	0.409091	23.2	26.4	28.7	0.001246	discard	implement genre-aware BM25 boosting with efficient candidate scoring and normalization
exp_222	discarded	0.318182	56.2	69.0	70.9	0.001226	discard	Implement lexical-semantic RRF with genre-intersection boosting and pre-computed popularity normalization
exp_223	discarded	0.272727	22.7	26.1	27.4	0.001276	discard	Improve cost and recall by using a genre-aware weighted BM25/Semantic fusion with a combined candidate pool and optimized numpy scoring.
exp_224	discarded	0.318182	22.6	26.8	28.1	0.001244	discard	use genre-aware candidate boosting with a larger pool and normalized log-popularity to capture long-tail semantic relationships
exp_225	discarded	0.363636	23.3	27.9	33.1	0.001227	discard	Use a larger candidate pool for BM25 and vector search with direct index lookups to preserve recall while streamlining scoring to maintain cost-efficiency.
exp_226	discarded	0.363636	22.4	26.3	29.0	0.001242	discard	Use a combined text index for BM25 and optimize RRF scoring with a genre-similarity boost to improve recall.
exp_227	discarded	0.000000	35.6	63.7	69.1	0.001174	discard	Use a combined text index for BM25 and optimize RRF scoring with a genre-similarity boost to improve recall.
exp_228	discarded	0.409091	37.7	59.6	66.3	0.001263	discard	Implement lexical-semantic RRF with genre-intersection boosting and pre-computed popularity normalization
exp_229	discarded	0.409091	26.3	31.0	31.4	0.001241	discard	use query-specific genre-vector similarity fusion and BM25 with title/overview fields to boost semantic alignment
exp_230	discarded	0.636364	28.1	30.9	31.5	0.001269	discard	Replace hybrid weighted sum with Reciprocal Rank Fusion (RRF) and genre-match term-boosting to capture niche query intents more effectively.
exp_231	discarded	0.409091	24.9	50.1	75.6	0.001255	discard	implement genre-aware BM25 boosting with efficient candidate scoring and normalization
exp_232	discarded	0.454545	23.7	28.9	37.3	0.001271	discard	implement genre-aware RRF with improved BM25 title-token density boosting
exp_233	discarded	0.272727	24.7	28.9	30.2	0.001248	discard	Improve cost and recall using a streamlined hybrid scoring mechanism with genre-based popularity boosting and direct numpy indexing.
exp_234	discarded	0.363636	22.6	29.7	38.6	0.001246	discard	optimize retrieval by incorporating a genre-affinity multiplier using efficient NumPy array indexing and reducing dataframe overhead to improve cost efficiency while maintaining recall.
exp_235	discarded	0.500000	21.5	26.8	27.9	0.001243	discard	optimize retrieval cost by using a unified candidate pool and genre-based popularity boosting with direct numpy operations
exp_236	discarded	0.227273	29.8	36.3	36.9	0.001262	discard	optimize retrieval by using a broader, more robust hybrid scoring with genre-weighted RRF for improved recall and rank stability
exp_237	discarded	0.409091	27.2	32.8	34.1	0.001283	discard	Improve cost and recall by using a genre-aware weighted score fusion that utilizes pre-computed genre masks to avoid redundant dataframe operations.
exp_238	discarded	0.318182	22.9	26.7	27.1	0.001290	discard	optimize retrieval cost by using a unified candidate pool of 400 with direct numpy scoring and genre-masking
exp_239	discarded	0.363636	25.1	36.3	41.8	0.001274	discard	Improve cost and recall by using a genre-aware reranking strategy on a unified candidate pool with direct index scoring.
exp_240	discarded	0.363636	30.3	36.8	37.9	0.001263	discard	use RRF with cross-field BM25 on text and genres to improve semantic coverage and title-match precision
exp_241	discarded	0.500000	29.1	36.1	62.4	0.001299	discard	Implement RRF with genre-intersection boosting and pre-computed popularity normalization using sparse BM25 and dense vector retrieval.
exp_242	discarded	0.500000	24.5	30.2	60.6	0.001240	discard	optimize cost by reducing pool size and using a lightweight RRF-based scoring mechanism
exp_243	discarded	0.363636	26.5	30.1	33.2	0.001321	discard	optimize retrieval with RRF and query-genre similarity boosting
exp_244	discarded	0.636364	22.6	33.5	39.6	0.001290	discard	Streamline hybrid retrieval using RRF and genre-affinity boosting with direct NumPy operations to minimize latency and dataframe overhead.
exp_245	discarded	0.227273	22.3	28.3	31.6	0.001308	discard	implement genre-aware query expansion for hybrid search and streamline the candidate pool scoring pipeline
exp_246	discarded	0.318182	25.5	35.8	37.0	0.001315	discard	improve hybrid retrieval by using a genre-weighted BM25-semantic ensemble with log-popularity dampening to refine ranking precision and recall
exp_247	discarded	0.454545	23.7	28.9	32.0	0.001306	discard	improve hybrid retrieval recall by using an expanded candidate pool and a genre-aware popularity boost to better match long-tail and ambiguous queries
exp_248	discarded	0.363636	23.4	28.3	35.7	0.001314	discard	Improve cost and recall using a genre-aware weighted BM25/Semantic hybrid scoring with direct numpy indexing to eliminate redundant dataframe operations.
exp_249	discarded	0.500000	23.3	26.7	29.6	0.001279	discard	utilize genre-aware BM25 and popularity boosting with an RRF-based scoring mechanism to optimize retrieval precision and cost
exp_250	crash	0.000000	inf			0.001317	crash	Use a larger candidate pool of 500 with RRF and a genre-aware popularity boost to improve recall and rank stability while keeping overhead minimal.
exp_251	crash	0.000000	inf			0.001310	crash	optimize cost by replacing redundant score normalization with raw score fusion and genre-masking for targeted boost
exp_252	discarded	0.409091	23.4	26.4	27.5	0.001354	discard	use RRF with cross-field BM25 on text and genre-boosted semantic search to improve recall
exp_253	discarded	0.409091	32.4	35.5	36.8	0.001321	discard	optimize retrieval with RRF and genre-boosted popularity scoring
exp_254	discarded	0.545455	23.5	27.9	29.5	0.001354	discard	optimize retrieval with RRF and genre-specific BM25 score amplification
exp_255	discarded	0.227273	25.7	29.3	29.8	0.001330	discard	Hybrid search using BM25 and vector similarity with genre-conditioned RRF to improve long-tail recall and efficiency.
exp_256	discarded	0.454545	23.5	29.0	72.5	0.001381	discard	Implement genre-aware reranking with log-popularity dampening using direct numpy indexing to improve cost efficiency and precision
exp_257	discarded	0.409091	23.0	28.5	54.9	0.001310	discard	Implement RRF with genre-boosted scores to improve recall and rank stability while reducing redundant dataframe overhead.
exp_258	discarded	0.409091	35.7	40.4	41.1	0.001367	discard	use RRF with genre-masking and popularity-adjusted BM25/semantic score integration to improve long-tail retrieval
exp_259	discarded	0.318182	25.4	28.1	29.0	0.001363	discard	implement genre-aware query expansion for hybrid search and streamline the candidate pool scoring pipeline
exp_260	discarded	0.318182	23.8	28.9	77.5	0.001339	discard	optimize retrieval with RRF and genre-boosted popularity scoring
exp_261	discarded	0.272727	26.8	30.9	31.9	0.001318	discard	RRF fusion with genre-weighted popularity scoring and streamlined indexing
exp_262	discarded	0.000000	25.3	36.0	51.6	0.001342	discard	implement lexical-semantic RRF with genre-intersection boosting and vote-count normalization to capture niche intent and improve ranking precision
exp_263	discarded	0.363636	29.6	35.6	57.0	0.001297	discard	hybrid search with term-frequency-aware title/genre BM25 weighting and RRF-based scoring
exp_264	discarded	0.272727	27.4	31.0	32.1	0.001269	discard	use RRF with cross-field BM25 on text and genre-boosted semantic search to improve recall
exp_265	discarded	0.409091	29.2	31.7	33.3	0.001299	discard	use RRF with cross-field BM25 on text and genres with genre-affinity boosting and popularity-aware reranking
exp_266	discarded	0.272727	29.5	32.9	33.8	0.001329	discard	Implement RRF with genre-aware rank boosting on a larger candidate pool to improve recall.
