exp_id	commit	recall	latency_ms	llm_cost_usd	status	description
exp_263	discarded	0.245098	549.0	0.000624	discard	# BM25 retrieve, rerank FAISS
exp_264	discarded	0.225490	8.1	0.000607	discard	# FAISS index with genre boost
exp_265	discarded	0.196078	10.7	0.000559	discard	# Simple BM25 index search
exp_266	discarded	0.284314	496.7	0.000620	discard	# BM25 retrieve, re-rank embedding
exp_267	discarded	0.196078	11.3	0.000574	discard	# Pure BM25 with title boost
exp_268	discarded	0.196078	11.1	0.000545	discard	# Pure FAISS L2 search
exp_269	discarded	0.235294	20.7	0.000638	discard	# Use BM25-based semantic re-ranking
exp_270	discarded	0.372549	20.6	0.000660	discard	# Rank by BM25 and popularity
exp_271	discarded	0.215686	21.6	0.000680	discard	# Multi-stage BM25 and Genre-Boosted FAISS
exp_272	discarded	0.235294	21.7	0.000630	discard	# Rank by BM25 and similarity
exp_273	discarded	0.196078	11.0	0.000599	discard	# BM25 retrieve, re-rank genres
exp_274	discarded	0.176471	20.1	0.000595	discard	# Rank by BM25 and genres
exp_275	discarded	0.196078	7.6	0.000548	discard	# Search only, top-k inner product
exp_276	discarded	0.245098	22.3	0.000642	discard	# Hybrid BM25 and vector fusion
exp_277	discarded	0.235294	210.7	0.000604	discard	# BM25 retrieve, re-rank embedding
exp_278	discarded	0.245098	923.5	0.000643	discard	# Normalized BM25-Semantic fusion
exp_279	discarded	0.245098	512.7	0.000637	discard	# BM25 retrieve, re-rank embedding
exp_280	discarded	0.205882	16.1	0.000589	discard	# BM25 retrieve, re-rank genres
exp_281	discarded	0.205882	41.0	0.000625	discard	# BM25 retrieve, re-rank genres
exp_282	discarded	0.196078	13.8	0.000641	discard	# BM25 retrieve, re-rank genres
exp_283	discarded	0.245098	120.3	0.000601	discard	# BM25 retrieve, re-rank embedding
exp_284	discarded	0.196078	187.9	0.000590	discard	# Rerank FAISS by text similarity
exp_285	discarded	0.196078	11.1	0.000615	discard	# BM25 retrieve, re-rank genres
exp_286	discarded	0.196078	12.4	0.000630	discard	# Rank by BM25 and genres
exp_287	discarded	0.235294	23.0	0.000659	discard	# Hybrid RRF on BM25/FAISS
exp_288	discarded	0.196078	8.1	0.000556	discard	# Pure semantic retrieval only
exp_289	crash	0.000000	0.0	0.000632	crash	# BM25 retrieve, re-rank embedding
exp_290	discarded	0.196078	8.5	0.000573	discard	# Pure FAISS L2 search
exp_291	discarded	0.225490	7.9	0.000646	discard	# Rank by genre string similarity
exp_292	discarded	0.245098	20.7	0.000640	discard	# Hybrid BM25 and vector search
exp_293	discarded	0.264706	21.1	0.000683	discard	# Hybrid retrieval with genre weight
