exp_id	commit	recall	latency_ms	latency_p95	latency_p99	llm_cost_usd	status	description
exp_267	discarded	0.181818	40.9	45.2	75.1	0.001348	discard	Use a hybrid RRF approach with explicit title keyword boosting and genre-affinity scoring to improve recall for long-tail and niche queries.
exp_268	discarded	0.409091	41.0	44.5	45.3	0.001324	discard	implement genre-aware RRF with title-weighted BM25 and popularity dampening
exp_269	discarded	0.454545	28.0	31.0	31.8	0.001369	discard	Implement RRF with genre-aware similarity and query-expanded semantic retrieval to address long-tail failures.
exp_270	discarded	0.454545	23.3	26.4	27.0	0.001373	discard	hybrid search with RRF and genre-boosted popularity scoring
exp_271	discarded	0.409091	35.9	38.4	80.6	0.001376	discard	Use RRF on an expanded 800-candidate pool with genre-intersection boosting and vote-score normalization to improve long-tail recall.
exp_272	discarded	0.545455	27.3	30.8	32.9	0.001366	discard	implement genre-aware query expansion with Reciprocal Rank Fusion on expanded candidate pools
exp_273	discarded	0.409091	31.6	43.3	77.4	0.001376	discard	use query-aware genre-vector similarity fusion and weighted BM25/Semantic scoring with log-popularity dampening to boost long-tail and genre-specific recall
exp_274	discarded	0.500000	25.4	29.9	30.9	0.001377	discard	enhance candidate selection using query-term genre boosting and popularity-aware reranking
exp_275	discarded	0.454545	30.2	38.6	41.7	0.001411	discard	Use RRF with genre-intersection boosting and title-token overlap scoring to improve rank precision for long-tail and ambiguous queries.
exp_276	discarded	0.363636	30.4	36.1	42.5	0.001390	discard	hybrid search with RRF, genre-weighted popularity, and title-term frequency boosting to improve long-tail recall
exp_277	discarded	0.045455	40.8	55.3	56.2	0.001388	discard	use RRF on a larger candidate pool with query-intent genre boosting and title-token frequency weighting
exp_278	discarded	0.500000	23.5	27.5	31.0	0.001370	discard	use RRF on a wider candidate pool with genre-semantic cross-attention weights and popularity-dampened scoring to improve retrieval recall
exp_279	discarded	0.454545	28.1	31.6	33.0	0.001393	discard	use RRF on a dual-pool retrieval with genre-conditional BM25 boosting and vote-score normalization to improve long-tail and genre-specific recall.
exp_280	discarded	0.409091	29.4	32.2	32.6	0.001390	discard	Implement lexical-semantic fusion with RRF, query-term-weighted genre matching, and explicit popularity dampening
exp_281	discarded	0.318182	23.4	39.7	41.2	0.001391	discard	use RRF with cross-field BM25 on text/genres and genre-affinity boosting
exp_282	discarded	0.136364	30.1	34.1	50.3	0.001374	discard	Implement RRF with genre-intersection boosting and title-token overlap scoring
exp_283	discarded	0.545455	23.2	26.0	27.8	0.001366	discard	use RRF on a broader candidate pool with genre-vector alignment and popularity-based rank adjustment
exp_284	discarded	0.545455	30.3	34.7	35.2	0.001352	discard	Use genre-conditioned RRF with balanced lexical-semantic scoring and popularity-based candidate selection.
exp_285	discarded	0.454545	22.5	31.7	39.1	0.001352	discard	use RRF on a dual-pool retrieval (BM25 + Semantic) with genre-intersection boosting and vote-score rank normalization to improve recall
exp_286	discarded	0.272727	30.3	33.3	35.2	0.001342	discard	Implement lexical-semantic RRF with genre-intersection boosting and query-intent genre weighting to improve long-tail recall.
exp_287	discarded	0.272727	29.7	33.1	35.2	0.001427	discard	Implement RRF with genre-intersection boosting and title-token density weighting to capture semantic and lexical nuance.
exp_288	crash	0.000000	inf			0.001389	crash	use RRF to aggregate BM25, semantic, and genre-alignment signals with direct index-based popularity boosting
exp_289	discarded	0.454545	32.4	35.0	35.5	0.001421	discard	use RRF on a dual-pool retrieval with genre-conditional scoring and normalized vote-count boosting to maximize recall.
exp_290	discarded	0.363636	32.5	37.0	45.4	0.001384	discard	use RRF on a dual-pool retrieval with genre-conditional scoring and normalized vote-count boosting to maximize recall.
exp_291	discarded	0.681818	23.9	27.9	28.6	0.001413	discard	use RRF on a dual-pool retrieval with genre-conditional BM25 boosting and vote-score normalization to improve long-tail and genre-specific recall.
exp_292	discarded	0.227273	54.8	57.2	60.9	0.001414	discard	Implement RRF with genre-intersection boosting and title-token overlap scoring
exp_293	discarded	0.409091	45.2	47.6	48.0	0.001418	discard	Implement RRF with expanded candidate pool and query-specific genre boosting based on text overlap and popularity.
exp_294	discarded	0.545455	30.5	33.5	34.5	0.001454	discard	RRF-based hybrid search with cross-field genre-boosted text indexing and popularity-aware score fusion.
exp_295	discarded	0.500000	22.6	27.2	29.0	0.001438	discard	use RRF to aggregate BM25, semantic, and genre-match scores with vote-based popularity boosting and a larger initial candidate pool
exp_296	discarded	0.363636	23.4	26.7	27.7	0.001443	discard	use Reciprocal Rank Fusion on larger candidate pools with genre-aware query expansion to boost long-tail and niche semantic coverage
exp_297	discarded	0.272727	38.2	42.3	43.7	0.001399	discard	use RRF on a 400-candidate pool with query-intent genre-vector alignment and title-boosted BM25
exp_298	discarded	0.590909	23.4	38.6	47.8	0.001452	discard	Use a larger candidate pool of 1000, incorporate genre-intersection as a secondary reranking signal, and use balanced Reciprocal Rank Fusion to aggregate BM25 and Semantic scores.
exp_299	discarded	0.363636	34.3	37.6	58.4	0.001439	discard	Implement RRF with genre-intersection boosting and query-intent genre weighting to improve long-tail recall.
exp_300	discarded	0.363636	40.3	43.9	126.1	0.001451	discard	implement genre-aware RRF with title-boosted BM25 and popularity dampening
exp_301	discarded	0.636364	29.3	31.9	33.3	0.001397	discard	Implement lexical-semantic RRF with genre-intersection boosting and query-intent genre weighting to improve recall for long-tail queries.
exp_302	discarded	0.409091	31.3	34.2	35.3	0.001444	discard	Implement RRF with genre-intersection boosting and query-intent title-text multi-field weighting
exp_303	discarded	0.272727	26.4	31.0	31.9	0.001432	discard	use RRF to aggregate BM25 on the full text field and semantic embeddings, with a genre-based candidate boost for niche query alignment
exp_304	discarded	0.454545	30.8	34.3	48.4	0.001438	discard	improve recall using BM25 query expansion and genre-aware weighted RRF on a larger candidate pool
exp_305	discarded	0.318182	39.4	42.1	43.2	0.001403	discard	implementation of hybrid retrieval using RRF on BM25 and semantic pools with genre-aware re-ranking
exp_306	discarded	0.545455	26.7	30.7	31.9	0.001441	discard	improve recall using BM25-semantic hybrid with genre-weighted RRF and popularity dampening
exp_307	discarded	0.636364	23.7	27.5	28.5	0.001445	discard	implement genre-aware RRF with title-boosted BM25 and popularity dampening
exp_308	discarded	0.363636	31.1	35.5	42.0	0.001484	discard	Implement RRF with genre-aware query expansion and title-weighted candidate boosting to bridge lexical-semantic gaps.
exp_309	discarded	0.545455	38.3	45.3	60.5	0.001432	discard	use RRF on a expanded dual-pool retrieval with genre-overlap boosting and popularity-dampened scoring
exp_310	discarded	0.272727	38.8	40.8	42.4	0.001431	discard	Utilize BM25 on the full text field with a larger 1000-candidate pool and RRF score aggregation to improve recall for long-tail queries.
exp_311	discarded	0.363636	34.6	37.3	37.8	0.001482	discard	incorporate genre-conditional semantic reranking with popularity-aware score fusion
exp_312	crash	0.000000	inf			0.001498	crash	add query-dependent genre expansion and rank-normalized RRF with title boost
exp_313	crash	0.000000	inf			0.001462	crash	use genre-aware reciprocal rank fusion with BM25 title boosting and popularity-dampened scoring
exp_314	discarded	0.318182	32.7	36.8	41.0	0.001455	discard	Implement lexical-semantic RRF with genre-intersection boosting and popularity-aware reranking
exp_315	discarded	0.545455	29.9	32.6	33.2	0.001490	discard	improve recall using genre-boosted RRF with multi-field BM25 expansion and popularity-based ranking
exp_316	discarded	0.500000	26.2	30.7	54.7	0.001492	discard	Implement lexical-semantic fusion with RRF on expanded candidates, leveraging genres for score biasing and popularity for tie-breaking.
exp_317	discarded	0.636364	22.7	27.6	29.7	0.001511	discard	implement genre-aware RRF with title-boosted BM25 and popularity-dampened scoring
exp_318	discarded	0.045455	24.5	28.8	29.4	0.001492	discard	Implement lexical-semantic RRF with query-intent genre vector alignment and title-boosted BM25
exp_319	discarded	0.500000	24.1	33.9	34.3	0.001515	discard	Implement lexical-semantic fusion with RRF on expanded candidates, using vote-weighted BM25 and genre-similarity re-ranking to boost long-tail recall.
exp_320	discarded	0.545455	29.2	32.7	52.5	0.001544	discard	Hybrid retrieval using RRF on title/text-field BM25 and semantic embeddings, with explicit genre-match boosting and log-popularity normalization.
exp_321	discarded	0.500000	30.8	33.5	35.6	0.001526	discard	use RRF with genre-aware BM25 field expansion and popularity-prioritized candidate ranking
exp_322	discarded	0.454545	25.7	50.1	50.7	0.001539	discard	Hybrid retrieval using RRF on title/text-field BM25 and semantic embeddings, with explicit genre-match boosting and log-popularity normalization.
exp_323	discarded	0.454545	33.0	36.3	37.7	0.001480	discard	boost recall using query-specific genre expansion and field-weighted RRF scoring
exp_324	discarded	0.318182	32.6	35.4	36.3	0.001495	discard	implement lexical-semantic RRF with title-boosted BM25 and popularity-weighted genre affinity
exp_325	discarded	0.500000	29.3	32.5	32.7	0.001518	discard	improve long-tail recall using genre-weighted BM25-semantic hybrid fusion and logarithmic popularity damping
exp_326	discarded	0.409091	57.7	66.0	68.4	0.001533	discard	Use cross-field BM25 on text + genres with RRF and genre-affinity re-ranking
exp_327	discarded	0.545455	29.2	32.1	32.9	0.001489	discard	Incorporate genre-based semantic boosting into the retrieval pipeline while optimizing candidate pooling and scoring for latency.
exp_328	discarded	0.000000	36.1	38.9	40.1	0.001506	discard	use RRF with cross-field BM25 and genre-aware popularity-weighted scoring
exp_329	discarded	0.545455	28.8	31.8	32.7	0.001499	discard	implement genre-boosted hybrid search with reciprocal rank fusion on an expanded candidate pool and direct numpy score normalization
exp_330	crash	0.000000	inf			0.001548	crash	improve retrieval with query-aware genre vector bias and title-weighted hybrid RRF
exp_331	ecdce40	0.681818	22.2	27.3	29.9	0.001501	keep	use query-expanded RRF with genre-intersection boosting to bridge lexical-semantic gaps
exp_332	discarded	0.318182	24.1	28.6	31.4	0.001478	discard	optimize latency by using a simplified RRF scoring pipeline with a 200-candidate pool and pre-normalized score fusion
exp_333	discarded	0.272727	23.4	26.4	56.1	0.001494	discard	optimize latency by using a streamlined candidate pool of 200 with direct numpy-based RRF and pre-calculated genre masks to reduce dataframe overhead
exp_334	discarded	0.500000	23.0	27.3	34.1	0.001515	discard	use query-expanded RRF with genre-intersection boosting to bridge lexical-semantic gaps
exp_335	discarded	0.090909	22.8	27.7	29.4	0.001482	discard	latency optimization using direct array indexing and reduced candidate pool without redundant dataframe copies
exp_336	crash	0.000000	inf			0.001497	crash	optimize latency by using local numpy pre-indexing for BM25 and pre-computed genre masks to avoid redundant dataframe operations during ranking
exp_337	discarded	0.318182	22.3	26.5	30.3	0.001502	discard	optimize latency by using a streamlined candidate pool of 200 with direct numpy-based RRF and pre-computed genre masks to avoid redundant dataframe operations
exp_338	discarded	0.363636	22.7	25.9	26.7	0.001510	discard	optimize latency by using a streamlined candidate pool of 200 with direct numpy-based RRF and pre-computed genre masks to avoid redundant dataframe operations
exp_339	06ac556	0.636364	22.0	26.5	26.9	0.001517	keep	optimize latency by using a streamlined candidate pool of 200 with direct numpy-based RRF and pre-computed genre masks, reducing redundant DataFrame operations.
exp_340	discarded	0.409091	22.5	27.1	39.1	0.001513	discard	optimize latency by using a streamlined candidate pool of 150 with vectorized score fusion and reduced dataframe operations
exp_341	discarded	0.454545	23.1	27.4	54.4	0.001506	discard	latency optimization using pre-filtered candidate pool and efficient ranking with minimal data conversion
exp_342	discarded	0.454545	23.2	28.0	73.6	0.001551	discard	optimize latency by using a vectorized BM25-semantic hybrid with genre-based popularity dampening and direct numpy indexing for candidate fusion
exp_343	discarded	0.590909	24.7	39.0	41.0	0.001545	discard	optimize latency by using a vectorized score fusion with a fixed 250-candidate pool and direct index-level scoring
exp_344	discarded	0.545455	23.9	26.4	29.1	0.001567	discard	Latency optimization using pre-filtered candidate pool and direct index-level scoring with balanced BM25/Semantic fusion.
exp_345	discarded	0.318182	1771.8	2296.0	2332.5	0.001547	discard	Latency optimization using pre-filtered BM25 score lookup and vectorized score fusion to minimize dataframe overhead
exp_346	discarded	0.363636	22.9	26.5	28.7	0.001563	discard	optimize latency by using pre-computed bm25 scores, reducing candidate pool to 150, and streamlining genre-affinity scoring with direct array operations.
exp_347	discarded	0.227273	23.4	26.5	27.6	0.001517	discard	optimize latency by using a pre-allocated scores array and direct numpy operations for hybrid RRF, reducing dataframe access and function overhead
exp_348	discarded	0.363636	24.3	28.0	33.1	0.001531	discard	optimize latency by using pre-computed BM25 indices and direct NumPy operations to avoid DataFrame overhead while maintaining robust retrieval with RRF.
exp_349	discarded	0.181818	23.3	26.9	28.8	0.001542	discard	reduce latency by pre-tokenizing query, using a single-pass hybrid score, and avoiding redundant array creation during genre-masking.
exp_350	crash	0.000000	inf			0.001529	crash	latency optimization by pre-calculating genre masks and using a unified 300-candidate pool with vectorized score fusion
exp_351	discarded	0.636364	24.1	28.9	38.9	0.001573	discard	optimize latency by using local numpy pre-indexing for BM25 and pre-computed genre masks, reducing dataframe overhead during score fusion
exp_352	discarded	0.545455	33.2	36.0	36.8	0.001555	discard	implement genre-aware RRF with title-text BM25 field boosting and popularity-dampened score fusion
exp_353	discarded	0.590909	22.4	27.9	54.2	0.001556	discard	hybrid search with term-frequency-aware title-field BM25 boosting and genre-aware rank fusion to improve long-tail and semantic recall
exp_354	discarded	0.318182	23.9	28.6	30.7	0.001574	discard	hybrid search with genre-boosted title density andpopularity-weighted RRF for long-tail retrieval
exp_355	discarded	0.545455	22.7	31.1	44.8	0.001589	discard	optimize retrieval with RRF, genre-specific BM25 weighting, and popularity dampening
exp_356	discarded	0.500000	23.8	37.7	42.5	0.001571	discard	hybrid search with term-frequency-aware title-field BM25 boosting and genre-aware rank fusion for enhanced long-tail recall
exp_357	discarded	0.636364	22.6	26.5	27.5	0.001557	discard	use weighted hybrid RRF with expanded text-field BM25 to improve semantic recall and rank stability
exp_358	discarded	0.545455	23.4	26.2	27.0	0.001572	discard	optimize cost and recall by using a normalized hybrid scoring with popularity-dampened genre boosting and title-token overlap scoring
exp_359	discarded	0.500000	22.3	27.1	29.1	0.001561	discard	Optimize retrieval cost by using a unified candidate pool of 300 with simplified scoring and direct NumPy indexing to reduce redundant DataFrame operations.
exp_360	discarded	0.318182	32.2	35.3	86.5	0.001588	discard	hybrid search with genre-aware RRF and title-keyword density prioritization
exp_361	discarded	0.454545	23.5	27.1	30.8	0.001557	discard	hybrid search with term-frequency-aware title-field BM25 boosting, genre-aware RRF, and log-popularity dampening to optimize cost and relevance
exp_362	discarded	0.318182	23.2	26.0	27.5	0.001566	discard	prioritize semantic retrieval with a genre-boosted re-ranking and reduced redundant dataframe operations to optimize cost
exp_363	discarded	0.409091	23.3	26.5	27.3	0.001575	discard	optimize retrieval cost by using a unified candidate pool of 200 with direct numpy scoring and genre-masking
exp_364	discarded	0.363636	28.5	32.2	40.9	0.001594	discard	optimize retrieval by incorporating title-specific BM25 weighting and refined genre affinity scoring into the RRF pipeline
exp_365	discarded	0.363636	22.3	37.2	53.2	0.001614	discard	use RRF with cross-field BM25 on text and genre-specific vote-boosted scoring for better long-tail recall
exp_366	discarded	0.454545	24.8	28.5	30.2	0.001607	discard	improve retrieval by incorporating title-weighted BM25 with dynamic genre-match boosting and popularity bias for better long-tail precision.
exp_367	discarded	0.409091	23.9	27.0	28.9	0.001604	discard	Use a combined text-field index with RRF-weighted genre and popularity boosting for efficient retrieval
exp_368	discarded	0.545455	23.8	27.6	28.4	0.001580	discard	optimize retrieval by using cross-field BM25 on text and genre-weighted RRF with popularity-adjusted rank fusion
exp_369	discarded	0.318182	23.7	27.6	28.4	0.001613	discard	implement balanced RRF with genre-intersection boosting and vote-adjusted score normalization to improve retrieval for long-tail and niche queries.
exp_370	discarded	0.363636	23.9	28.2	37.9	0.001603	discard	use BM25 on the full text field and combine with semantic search via normalized RRF to capture long-tail queries, using direct array indexing to minimize cost
exp_371	discarded	0.681818	22.6	26.6	27.0	0.001604	discard	use query-aware BM25 field-weighting with semantic RRF and genre-affinity boosting
exp_372	discarded	0.409091	29.0	31.9	32.4	0.001607	discard	implement genre-aware RRF with title-text field-weighted BM25 for balanced retrieval
exp_373	discarded	0.409091	24.6	28.6	29.5	0.001607	discard	Use RRF on a 400-candidate pool with query-intent genre weighting and title-text BM25 field boosting.
exp_374	discarded	0.363636	24.3	28.6	37.1	0.001618	discard	use RRF on a dual-pool retrieval with BM25 title-boosted weighting and direct numpy-indexed popularity normalization to improve long-tail and genre-specific recall while minimizing cost.
exp_375	discarded	0.545455	23.1	28.9	30.0	0.001631	discard	use weighted RRF with title-text field BM25 and genre-vote signal integration to capture semantic and long-tail nuance
exp_376	discarded	0.409091	22.5	26.5	33.0	0.001616	discard	optimize retrieval by using direct index access to popularity and genre signals without full dataframe filtering to reduce latency and cost
exp_377	discarded	0.409091	22.9	27.3	29.4	0.001625	discard	optimize retrieval by incorporating genre-aware semantic vector expansion and BM25 term frequency boosting to capture niche query intents without increasing latency
exp_378	discarded	0.272727	23.5	26.9	31.0	0.001644	discard	add query-dependent genre embedding boost and streamline hybrid scoring for cost efficiency
exp_379	discarded	0.500000	23.1	35.7	52.7	0.001646	discard	Use RRF with genre-intersection boosting and pre-computed popularity normalization on a unified candidate pool to improve retrieval for long-tail queries without increasing latency.
exp_380	discarded	0.318182	23.3	26.5	27.5	0.001625	discard	optimize retrieval by using a consolidated candidate pool with normalized hybrid scoring and direct numpy indexing to reduce overhead and cost
exp_381	discarded	0.636364	22.9	26.6	29.9	0.001639	discard	use query-specific genre expansion and streamlined RRF scoring with pre-calculated popularity signals to minimize overhead and improve retrieval precision
